{"$id":"https://cumulativewebinc.github.io/cwi-trust/reputation-schema.json","$schema":"https://json-schema.org/draft/2020-12/schema","allOf":[{"if":{"properties":{"record_status":{"const":"submittable"}}},"then":{"properties":{"agentId":{"minimum":0,"type":"integer"},"agentRegistry":{"pattern":"^eip155:[0-9]+:0x[0-9a-fA-F]{40}$"},"clientAddress":{"pattern":"^eip155:[0-9]+:0x[0-9a-fA-F]{40}$|^0x[0-9a-fA-F]{40}$"}},"required":["feedbackURI","feedbackHash"]}},{"if":{"properties":{"tag1":{"not":{"enum":["starred","reachable","ownerVerified","uptime","successRate","responseTime","blocktimeFreshness","revenues","tradingYield"]}}}},"then":{"properties":{"cwi":{"required":["value_semantics"]}}}}],"description":"ERC-8004 Reputation-registry off-chain feedback file shape (spec MUST fields + proofOfPayment for x402) plus one namespaced 'cwi' extension block. Run-2 decision: every cwi.evidence item MUST carry a machine-checkable source pointer, or the record fails validation.","properties":{"a2a":{"type":"object"},"agentId":{"description":"On-chain agent id. Pre-registration: the literal string TBD.","type":["integer","string"]},"agentRegistry":{"description":"CAIP-2 chain + identity registry, e.g. eip155:1:0x.... Pre-registration: the literal string TBD.","minLength":1,"type":"string"},"clientAddress":{"description":"Feedback giver. Spec: SHOULD be the agentWallet address when the client is an agent. Pre-designation: TBD.","minLength":1,"type":"string"},"createdAt":{"format":"date-time","type":"string"},"cwi":{"additionalProperties":false,"properties":{"engine_input_sha256":{"description":"input_sha256 from the trust-verdict engine run this record's evidence was scored with.","pattern":"^[0-9a-f]{64}$","type":"string"},"engine_status":{"enum":["scored","insufficient-data","evidence-disputed"],"type":"string"},"evidence":{"items":{"additionalProperties":false,"properties":{"description":{"minLength":1,"type":"string"},"kind":{"enum":["needle_drop","trust_log","engine_run","first_spin","endpoint_check","note"],"type":"string"},"observed_at":{"format":"date-time","type":"string"},"source":{"description":"Machine-checkable pointer: URL, repo path, or content hash. Never a bare assertion.","minLength":1,"type":"string"}},"required":["kind","description","source","observed_at"],"type":"object"},"minItems":1,"type":"array"},"value_semantics":{"description":"REQUIRED when tag1 is not a spec-table convention: what the value number means.","minLength":1,"type":"string"}},"required":["evidence"],"type":"object"},"endpoint":{"type":"string"},"feedbackHash":{"description":"keccak256 of the file at feedbackURI (64 hex chars). REQUIRED when record_status=submittable.","pattern":"^[0-9a-f]{64}$","type":"string"},"feedbackURI":{"type":"string"},"mcp":{"type":"object"},"oasf":{"type":"object"},"proofOfPayment":{"additionalProperties":false,"description":"x402 payment proof — the receipts-to-portable-trust linkage. Omitted until real x402 settlements exist.","properties":{"chainId":{"minLength":1,"type":"string"},"fromAddress":{"pattern":"^0x[0-9a-fA-F]{40}$","type":"string"},"toAddress":{"pattern":"^0x[0-9a-fA-F]{40}$","type":"string"},"txHash":{"pattern":"^0x[0-9a-fA-F]{64}$","type":"string"}},"required":["fromAddress","toAddress","chainId","txHash"],"type":"object"},"record_status":{"description":"prep-draft = chain facts not yet real (TBD placeholders allowed). submittable = every spec MUST field is concrete and feedbackHash present.","enum":["prep-draft","submittable"],"type":"string"},"tag1":{"type":"string"},"tag2":{"type":"string"},"value":{"description":"Signed fixed-point feedback value (int128 on chain; exact range enforced by validate_reputation.py).","type":"integer"},"valueDecimals":{"maximum":18,"minimum":0,"type":"integer"}},"required":["agentRegistry","agentId","clientAddress","createdAt","value","valueDecimals","record_status","cwi"],"title":"CWI ERC-8004 Reputation Feedback Record","type":"object"}