{"agentId":"TBD — no on-chain identity yet; registration waits for Black's wallet/gas tap","agentRegistry":"TBD — eip155:{chainId}:{identityRegistry} at registration","clientAddress":"TBD — CWI agent wallet not yet designated (Black's tap)","createdAt":"2026-09-22T12:52:18Z","cwi":{"engine_input_sha256":"86e2e02aa830b21f4fe59c5548927b649b642f840f1d9b941676bc5e3bb354e5","engine_status":"insufficient-data","evidence":[{"description":"NEEDLE DROP ledger (cwi-needledrop/v1) verify() 2026-09-22: 'OK: chain intact', 0 placements — ships empty by design.","kind":"needle_drop","observed_at":"2026-09-22T12:55:00Z","source":"~/workspace/cwi-company/gear-line/needle-drop/needle-drop.json :: ledger.py verify"},{"description":"cwi-trust-log VERIFIED: 'Playlist placements re-verified holding (2026-09-18)'.","kind":"trust_log","observed_at":"2026-09-18T00:00:00Z","source":"https://cumulativewebinc.github.io/cwi-trust-log/claims/clm_01M2V5HK1KSND8WYRHCA0QPA85.html"},{"description":"cwi-trust-log VERIFIED: 'KingCode Lens v1.0.0 shipped to production' (117/117 tests green).","kind":"trust_log","observed_at":"2026-09-18T00:00:00Z","source":"https://cumulativewebinc.github.io/cwi-trust-log/claims/clm_01M2V5HK1H7810RPMYXA47E0J5.html"},{"description":"Trust-verdict engine run on this evidence: status insufficient-data (0 verified erc8004 items; 1 of 2 required families). Harness: response=null, chain_action=defer. Two runs byte-identical.","kind":"engine_run","observed_at":"2026-09-22T12:52:18Z","source":"validation/examples/kingcode-coldstart-input.json :: validation/harness.py"}],"value_semantics":"0 = no scored reputation yet. This record indexes verified evidence only; it asserts no rating and no endorsement. A numeric reputation begins only after on-chain registration plus third-party verified evidence."},"endpoint":"https://cumulativewebinc.github.io/cwi-trust-log/","record_status":"prep-draft","tag1":"bootstrap","tag2":"cold-start/evidence-index","value":0,"valueDecimals":0}